### ISSUE TITLE
Is IP source set randomly by default ?

### ISSUE THREAD

**Issue by Paulo-21** [wiseaidev/rping#9]
Hello, i would like to know if the source ip address is randomly generated,  i have seen a commit related to it but just would like to ensure.
In this case, it would be preferable to specify this in the functionality paragraph ?

**Comment by wiseaidev** [comment]
> the source ip address is randomly generate

Of course! You can test it yourself by running `rping -t 127.0.0.1` and `sudo tcpdump -i lo port 80 -v` in a separate terminal. You will see the source IP address being randomized.

<details>
<summary><code>sudo tcpdump -i lo port 80 -v</code></summary>

```sh
tcpdump: listening on lo, link-type EN10MB (Ethernet), snapshot length 262144 bytes
20:05:04.353414 IP (tos 0x0, ttl 50, id 35922, offset 0, flags [none], proto TCP (6), length 1500)
    175.136.11.199.59069 > localhost.http: Flags [S], cksum 0x2d51 (correct), seq 4143480882:4143482342, win 0, length 1460: HTTP
20:05:04.353420 IP (tos 0x0, ttl 50, id 6610, offset 0, flags [none], proto TCP (6), length 1500)
    181-163-17-65.baf.movistar.cl.34028 > localhost.http: Flags [S], cksum 0xca80 (correct), seq 2412187512:2412188972, win 0, length 1460: HTTP
20:05:04.353442 IP (tos 0x0, ttl 50, id 7655, offset 0, flags [none], proto TCP (6), length 1500)
    232.238.218.24.42270 > localhost.http: Flags [S], cksum 0x9622 (correct), seq 2546107763:2546109223, win 0, length 1460: HTTP
20:05:04.353455 IP (tos 0x0, ttl 1, id 0, offset 0, flags [DF], proto TCP (6), length 40)
    localhost.http > 232.238.218.24.42270: Flags [R.], cksum 0xa56e (correct), seq 0, ack 2546109224, win 0, length 0
20:05:04.353492 IP (tos 0x0, ttl 50, id 8216, offset 0, flags [none], proto TCP (6), length 1500)
    176.233.175.26.58243 > localhost.http: Flags [S], cksum 0xebde (correct), seq 4050681888:4050683348, win 0, length 1460: HTTP
20:05:04.353508 IP (tos 0x0, ttl 50, id 31530, offset 0, flags [none], proto TCP (6), length 1500)
    17.78.4.31.53432 > localhost.http: Flags [S], cksum 0x9665 (correct), seq 1363838626:1363840086, win 0, length 1460: HTTP
20:05:04.353540 IP (tos 0x0, ttl 50, id 8315, offset 0, flags [none], proto TCP (6), length 1500)
    34.63.219.156.32550 > localhost.http: Flags [S], cksum 0x129c (correct), seq 178820892:178822352, win 0, length 1460: HTTP
20:05:04.353541 IP (tos 0x0, ttl 50, id 32945, offset 0, flags [none], proto TCP (6), length 1500)
    246.146.224.99.49991 > localhost.http: Flags [S], cksum 0xdf89 (correct), seq 1256381174:1256382634, win 0, length 1460: HTTP
20:05:04.353567 IP (tos 0x0, ttl 50, id 2081, offset 0, flags [none], proto TCP (6), length 1500)
    host-41-196-60-164.static.link.com.eg.19414 > localhost.http: Flags [S], cksum 0x17f3 (correct), seq 2775170079:2775171539, win 0, length 1460: HTTP
20:05:04.353584 IP (tos 0x0, ttl 50, id 34498, offset 0, flags [none], proto TCP (6), length 1500)
    56.54.138.157.6420 > localhost.http: Flags [S], cksum 0xb66f (correct), seq 3095150244:3095151704, win 0, length 1460: HTTP
20:05:04.353635 IP (tos 0x0, ttl 50, id 47374, offset 0, flags [none], proto TCP (6), length 1500)
    51.28.92.248.37546 > localhost.http: Flags [S], cksum 0xfd2f (incorrect -> 0xfd2e), seq 2342905257:2342906717, win 0, length 1460: HTTP
20:05:04.353645 IP (tos 0x0, ttl 50, id 36463, offset 0, flags [none], proto TCP (6), length 1500)
    229.195.20.94.9727 > localhost.http: Flags [S], cksum 0x29f1 (correct), seq 1878932944:1878934404, win 0, length 1460: HTTP
20:05:04.353645 IP (tos 0x0, ttl 50, id 22546, offset 0, flags [none], proto TCP (6), length 1500)
    dsl-189-250-127-95-dyn.prod-infinitum.com.mx.52582 > localhost.http: Flags [S], cksum 0x2625 (correct), seq 235688172:235689632, win 0, length 1460: HTTP
20:05:04.353658 IP (tos 0x0, ttl 50, id 17290, offset 0, flags [none], proto TCP (6), length 1500)
    183.169.249.215.18903 > localhost.http: Flags [S], cksum 0x528c (correct), seq 1556847822:1556849282, win 0, length 1460: HTTP
20:05:04.353661 IP (tos 0x0, ttl 1, id 0, offset 0, flags [DF], proto TCP (6), length 40)
    localhost.http > 229.195.20.94.9727: Flags [R.], cksum 0x5cdb (correct), seq 0, ack 1878934405, win 0, length 0
20:05:04.353686 IP (tos 0x0, ttl 50, id 28342, offset 0, flags [none], proto TCP (6), length 1500)
    046075152218.atmpu0013.highway.a1.net.47596 > localhost.http: Flags [S], cksum 0x1251 (correct), seq 2671807358:2671808818, win 0, length 1460: HTTP
20:05:04.353702 IP (tos 0x0, ttl 50, id 10261, offset 0, flags [none], proto TCP (6), length 1500)
    199.92.233.166.38436 > localhost.http: Flags [S], cksum 0x274a (correct), seq 3207176596:3207178056, win 0, length 1460: HTTP
20:05:04.353721 IP (tos 0x0, ttl 50, id 58262, offset 0, flags [none], proto TCP (6), length 1500)
    224.85-179-91.adsl-dyn.isp.belgacom.be.4667 > localhost.http: Flags [S], cksum 0xfd73 (incorrect -> 0xfd72), seq 1663129769:1663131229, win 0, length 1460: HTTP
20:05:04.353742 IP (tos 0x0, ttl 50, id 61083, offset 0, flags [none], proto TCP (6), length 1500)
    95.56.147.248.dynamic.telecom.kz.32319 > localhost.http: Flags [S], cksum 0x1b9e (correct), seq 4197306355:4197307815, win 0, length 1460: HTTP
20:05:04.353753 IP (tos 0x0, ttl 50, id 45154, offset 0, flags [none], proto TCP (6), length 1500)
    198.35.74.142.37889 > localhost.http: Flags [S], cksum 0x5c55 (correct), seq 2268137678:2268139138, win 0, length 1460: HTTP
20:05:04.353792 IP (tos 0x0, ttl 50, id 32122, offset 0, flags [none], proto TCP (6), length 1500)
    56.118.114.200.56703 > localhost.http: Flags [S], cksum 0x5e68 (correct), seq 2446482633:2446484093, win 0, length 1460: HTTP
20:05:04.353800 IP (tos 0x0, ttl 50, id 33917, offset 0, flags [none], proto TCP (6), length 1500)
    0.254.206.47.65208 > localhost.http: Flags [S], cksum 0xb078 (correct), seq 1090309840:1090311300, win 0, length 1460: HTTP
20:05:04.353804 IP (tos 0x0, ttl 50, id 58515, offset 0, flags [none], proto TCP (6), length 1500)
    cpc146322-oldh12-2-0-cust490.10-1.cable.virginm.net.42520 > localhost.http: Flags [S], cksum 0xb260 (correct), seq 3754350380:3754351840, win 0, length 1460: HTTP
20:05:04.353818 IP (tos 0x0, ttl 50, id 64217, offset 0, flags [none], proto TCP (6), length 1500)
    21.7.232.15.56793 > localhost.http: Flags [S], cksum 0xea83 (correct), seq 1323878043:1323879503, win 0, length 1460: HTTP
20:05:04.353838 IP (tos 0x0, ttl 50, id 24259, offset 0, flags [none], proto TCP (6), length 1500)
    32.87.91.172.4228 > localhost.http: Flags [S], cksum 0xa2e8 (correct), seq 755845310:755846770, win 0, length 1460: HTTP
20:05:04.353849 IP (tos 0x0, ttl 50, id 20577, offset 0, flags [none], proto TCP (6), length 1500)
    10.135.97.179.52553 > localhost.http: Flags [S], cksum 0xbb00 (correct), seq 1097585284:1097586744, win 0, length 1460: HTTP
20:05:04.353864 IP (tos 0x0, ttl 50, id 18827, offset 0, flags [none], proto TCP (6), length 1500)
    74.119.9.134.60474 > localhost.http: Flags [S], cksum 0xf380 (correct), seq 695079489:695080949, win 0, length 1460: HTTP
20:05:04.353869 IP (tos 0x0, ttl 50, id 39665, offset 0, flags [none], proto TCP (6), length 1500)
    204.165.176.1.35569 > localhost.http: Flags [S], cksum 0x3671 (correct), seq 1138811371:1138812831, win 0, length 1460: HTTP
20:05:04.353875 IP (tos 0x0, ttl 50, id 21723, offset 0, flags [none], proto TCP (6), length 1500)
    adsl196-116-168-217-196.adsl196-14.iam.net.ma.58441 > localhost.http: Flags [S], cksum 0x7817 (correct), seq 3431950316:3431951776, win 0, length 1460: HTTP
20:05:04.353886 IP (tos 0x0, ttl 50, id 38448, offset 0, flags [none], proto TCP (6), length 1500)
    202.19.96.235.36096 > localhost.http: Flags [S], cksum 0xacf6 (correct), seq 2769119215:2769120675, win 0, length 1460: HTTP
20:05:04.353893 IP (tos 0x0, ttl 50, id 34901, offset 0, flags [none], proto TCP (6), length 1500)
    adsl-99-29-251-65.dsl.irvnca.sbcglobal.net.8300 > localhost.http: Flags [S], cksum 0x3526 (correct), seq 1320842593:1320844053, win 0, length 1460: HTTP
20:05:04.353940 IP (tos 0x0, ttl 50, id 10774, offset 0, flags [none], proto TCP (6), length 1500)
    166.78.126.20.16310 > localhost.http: Flags [S], cksum 0xa728 (correct), seq 2861170865:2861172325, win 0, length 1460: HTTP
20:05:04.353962 IP (tos 0x0, ttl 50, id 6753, offset 0, flags [none], proto TCP (6), length 1500)
    57.61.154.219.30475 > localhost.http: Flags [S], cksum 0x033b (correct), seq 1232194000:1232195460, win 0, length 1460: HTTP
20:05:04.353965 IP (tos 0x0, ttl 50, id 46114, offset 0, flags [none], proto TCP (6), length 1500)
    172.143.97.27.38514 > localhost.http: Flags [S], cksum 0x9684 (correct), seq 1597044757:1597046217, win 0, length 1460: HTTP
20:05:04.353977 IP (tos 0x0, ttl 50, id 41387, offset 0, flags [none], proto TCP (6), length 1500)
    240.80.213.245.30205 > localhost.http: Flags [S], cksum 0x1396 (correct), seq 2093611871:2093613331, win 0, length 1460: HTTP
20:05:04.353994 IP (tos 0x0, ttl 50, id 55465, offset 0, flags [none], proto TCP (6), length 1500)
    107-138-169-240.lightspeed.irvnca.sbcglobal.net.62731 > localhost.http: Flags [S], cksum 0x4237 (correct), seq 3762465989:3762467449, win 0, length 1460: HTTP
20:05:04.354008 IP (tos 0x0, ttl 50, id 62591, offset 0, flags [none], proto TCP (6), length 1500)
    248.217.111.49.25501 > localhost.http: Flags [S], cksum 0xad28 (correct), seq 1396463026:1396464486, win 0, length 1460: HTTP
20:05:04.354016 IP (tos 0x0, ttl 50, id 54641, offset 0, flags [none], proto TCP (6), length 1500)
    4.246.45.155.12286 > localhost.http: Flags [S], cksum 0x66dc (correct), seq 314325476:314326936, win 0, length 1460: HTTP
20:05:04.354020 IP (tos 0x0, ttl 50, id 58591, offset 0, flags [none], proto TCP (6), length 1500)
    223.118.198.35.bc.googleusercontent.com.4005 > localhost.http: Flags [S], cksum 0xa797 (correct), seq 2173570697:2173572157, win 0, length 1460: HTTP
20:05:04.354028 IP (tos 0x0, ttl 50, id 37970, offset 0, flags [none], proto TCP (6), length 1500)
    102.21.61.206.61000 > localhost.http: Flags [S], cksum 0x5e43 (correct), seq 1384414162:1384415622, win 0, length 1460: HTTP
20:05:04.354071 IP (tos 0x0, ttl 50, id 7408, offset 0, flags [none], proto TCP (6), length 1500)
    223.74.86.109.triolan.net.41286 > localhost.http: Flags [S], cksum 0xf572 (correct), seq 3785087288:3785088748, win 0, length 1460: HTTP
20:05:04.354077 IP (tos 0x0, ttl 50, id 20143, offset 0, flags [none], proto TCP (6), length 1500)
    179-81-80-236.user.vivozap.com.br.60367 > localhost.http: Flags [S], cksum 0x8bff (correct), seq 570734549:570736009, win 0, length 1460: HTTP
20:05:04.354088 IP (tos 0x0, ttl 50, id 7678, offset 0, flags [none], proto TCP (6), length 1500)
    243.195.184.14.1464 > localhost.http: Flags [S], cksum 0x6e8a (correct), seq 1635079963:1635081423, win 0, length 1460: HTTP
20:05:04.354101 IP (tos 0x0, ttl 50, id 53870, offset 0, flags [none], proto TCP (6), length 1500)
    4.246.255.27.37277 > localhost.http: Flags [S], cksum 0x22f5 (correct), seq 2914626966:2914628426, win 0, length 1460: HTTP
20:05:04.354107 IP (tos 0x0, ttl 50, id 1876, offset 0, flags [none], proto TCP (6), length 1500)
    106.pool92-177-95.dynamic.orange.es.24746 > localhost.http: Flags [S], cksum 0x67b8 (correct), seq 2513608200:2513609660, win 0, length 1460: HTTP
20:05:04.354120 IP (tos 0x0, ttl 50, id 54769, offset 0, flags [none], proto TCP (6), length 1500)
    host142782410.vodafone.com.tr.28366 > localhost.http: Flags [S], cksum 0x662c (correct), seq 236336697:236338157, win 0, length 1460: HTTP
20:05:04.354138 IP (tos 0x0, ttl 50, id 2268, offset 0, flags [none], proto TCP (6), length 1500)
    196.166.159.137.5564 > localhost.http: Flags [S], cksum 0x41f3 (correct), seq 2286268204:2286269664, win 0, length 1460: HTTP
20:05:04.354145 IP (tos 0x0, ttl 50, id 3777, offset 0, flags [none], proto TCP (6), length 1500)
    185.sub-70-194-168.myvzw.com.3407 > localhost.http: Flags [S], cksum 0x6612 (correct), seq 2733857833:2733859293, win 0, length 1460: HTTP
20:05:04.354154 IP (tos 0x0, ttl 50, id 28206, offset 0, flags [none], proto TCP (6), length 1500)
    196.86.167.105.48395 > localhost.http: Flags [S], cksum 0xb4e4 (correct), seq 2467175990:2467177450, win 0, length 1460: HTTP
20:05:04.354166 IP (tos 0x0, ttl 50, id 21626, offset 0, flags [none], proto TCP (6), length 1500)
    231.75.122.232.53872 > localhost.http: Flags [S], cksum 0x5d6d (correct), seq 1966567704:1966569164, win 0, length 1460: HTTP
20:05:04.354167 IP (tos 0x0, ttl 50, id 53201, offset 0, flags [none], proto TCP (6), length 1500)
    243.5.84.81.3939 > localhost.http: Flags [S], cksum 0x7617 (correct), seq 692802710:692804170, win 0, length 1460: HTTP
20:05:04.354177 IP (tos 0x0, ttl 1, id 0, offset 0, flags [DF], proto TCP (6), length 40)
    localhost.http > 231.75.122.232.53872: Flags [R.], cksum 0x0fd6 (correct), seq 0, ack 1966569165, win 0, length 0
20:05:04.354191 IP (tos 0x0, ttl 50, id 52665, offset 0, flags [none], proto TCP (6), length 1500)
    6.206.139.17.34416 > localhost.http: Flags [S], cksum 0x2995 (correct), seq 1695208192:1695209652, win 0, length 1460: HTTP
20:05:04.354196 IP (tos 0x0, ttl 50, id 24496, offset 0, flags [none], proto TCP (6), length 1500)
    144.194.71.132.64335 > localhost.http: Flags [S], cksum 0xe6e8 (correct), seq 2385211985:2385213445, win 0, length 1460: HTTP
20:05:04.354209 IP (tos 0x0, ttl 50, id 14862, offset 0, flags [none], proto TCP (6), length 1500)
    217.26.184.14.48630 > localhost.http: Flags [S], cksum 0x4310 (correct), seq 2541961950:2541963410, win 0, length 1460: HTTP
20:05:04.354219 IP (tos 0x0, ttl 50, id 8755, offset 0, flags [none], proto TCP (6), length 1500)
    117.113.253.217.52256 > localhost.http: Flags [S], cksum 0x79e5 (correct), seq 1388032065:1388033525, win 0, length 1460: HTTP
```

</details>

Both IP and TCP packets are carefully crafted to simulate a fully anonymous any flag TCP DoS Flood. Have a look at the source code/docs for more info.

> In this case, it would be preferable to specify this in the functionality paragraph ?

Feel free to contribute; PRs are always welcome.

**Comment by Paulo-21** [comment]
Nice thank you !
I have done a PR about it
